{
  "agent": "council-director",
  "attempts": 1,
  "budget_exceeded": false,
  "completed": true,
  "escalated": false,
  "model": "claude-opus-5",
  "run_id": "01-business-model-design-council",
  "task_id": "council",
  "tokens": {
    "context": 18,
    "output": 3882,
    "retrieved": 0,
    "system": 5270,
    "total": 9170
  }
}